{
  "schema_version": "graph-quality/v1",
  "generated_at": "2026-04-26T17:45:32.635Z",
  "generation_id": "20260426174532276",
  "repo_root": "/Users/kuang/xiaobu/spec-first",
  "advisory": true,
  "coverage": {
    "final_input_count": 191,
    "parsed_count": 41,
    "skipped_count": 0,
    "no_parser_count": 0,
    "parse_error_count": 4,
    "module_only_count": 9,
    "skipped_sensitive_count": 3,
    "parser_success_rate": 0.2147,
    "samples": {
      "skipped": [],
      "no_parser": [],
      "parse_error": [
        "src/cli/commands/doctor.js",
        "src/cli/plugin.js",
        "src/crg/parser.js",
        "tests/contracts/crg-cli-v1.test.js"
      ]
    }
  },
  "graph": {
    "node_count": 927,
    "edge_count": 2356,
    "nodes_by_kind": {
      "module": 187,
      "function": 645,
      "class": 19,
      "method": 69,
      "struct": 2,
      "interface": 5
    },
    "edges_by_kind": {
      "contains": 730,
      "calls": 682,
      "defined_in": 740,
      "imports_from": 204
    },
    "confidence_distribution": {
      "nodes": {
        "Observed": 927
      },
      "edges": {
        "Inferred": 2062,
        "Observed": 294
      }
    },
    "edge_resolution_methods": {
      "unknown": 1679,
      "direct_target_id": 294,
      "module_path_exact": 177,
      "relative_path_extension_probe": 100,
      "symbol_unique": 106
    }
  },
  "unresolved_edges": {
    "count": 1111,
    "rate": 0.3204,
    "by_kind": {
      "imports_from": 100,
      "calls": 1011
    },
    "by_reason": {
      "no_match": 1085,
      "ambiguous": 26
    },
    "by_resolution_method": {
      "unresolved": 1111
    },
    "samples": [
      {
        "source_id": "skills/feature-video/scripts/capture-demo.py#module#capture-demo.py#L0",
        "source_file": "skills/feature-video/scripts/capture-demo.py",
        "edge_kind": "imports_from",
        "target_name": "argparse",
        "target_path_raw": "argparse",
        "reason": "no_match",
        "evidence": "[]"
      },
      {
        "source_id": "skills/feature-video/scripts/capture-demo.py#module#capture-demo.py#L0",
        "source_file": "skills/feature-video/scripts/capture-demo.py",
        "edge_kind": "imports_from",
        "target_name": "json",
        "target_path_raw": "json",
        "reason": "no_match",
        "evidence": "[]"
      },
      {
        "source_id": "skills/feature-video/scripts/capture-demo.py#module#capture-demo.py#L0",
        "source_file": "skills/feature-video/scripts/capture-demo.py",
        "edge_kind": "imports_from",
        "target_name": "os",
        "target_path_raw": "os",
        "reason": "no_match",
        "evidence": "[]"
      },
      {
        "source_id": "skills/feature-video/scripts/capture-demo.py#module#capture-demo.py#L0",
        "source_file": "skills/feature-video/scripts/capture-demo.py",
        "edge_kind": "imports_from",
        "target_name": "re",
        "target_path_raw": "re",
        "reason": "no_match",
        "evidence": "[]"
      },
      {
        "source_id": "skills/feature-video/scripts/capture-demo.py#module#capture-demo.py#L0",
        "source_file": "skills/feature-video/scripts/capture-demo.py",
        "edge_kind": "imports_from",
        "target_name": "shutil",
        "target_path_raw": "shutil",
        "reason": "no_match",
        "evidence": "[]"
      },
      {
        "source_id": "skills/feature-video/scripts/capture-demo.py#module#capture-demo.py#L0",
        "source_file": "skills/feature-video/scripts/capture-demo.py",
        "edge_kind": "imports_from",
        "target_name": "subprocess",
        "target_path_raw": "subprocess",
        "reason": "no_match",
        "evidence": "[]"
      },
      {
        "source_id": "skills/feature-video/scripts/capture-demo.py#module#capture-demo.py#L0",
        "source_file": "skills/feature-video/scripts/capture-demo.py",
        "edge_kind": "imports_from",
        "target_name": "sys",
        "target_path_raw": "sys",
        "reason": "no_match",
        "evidence": "[]"
      },
      {
        "source_id": "skills/feature-video/scripts/capture-demo.py#module#capture-demo.py#L0",
        "source_file": "skills/feature-video/scripts/capture-demo.py",
        "edge_kind": "imports_from",
        "target_name": "tempfile",
        "target_path_raw": "tempfile",
        "reason": "no_match",
        "evidence": "[]"
      },
      {
        "source_id": "skills/feature-video/scripts/capture-demo.py#module#capture-demo.py#L0",
        "source_file": "skills/feature-video/scripts/capture-demo.py",
        "edge_kind": "imports_from",
        "target_name": "time",
        "target_path_raw": "time",
        "reason": "no_match",
        "evidence": "[]"
      },
      {
        "source_id": "skills/feature-video/scripts/capture-demo.py#module#capture-demo.py#L0",
        "source_file": "skills/feature-video/scripts/capture-demo.py",
        "edge_kind": "imports_from",
        "target_name": "datetime",
        "target_path_raw": "datetime",
        "reason": "no_match",
        "evidence": "[]"
      }
    ]
  },
  "retrieval_index": {
    "fts_indexed": 927,
    "fts_skipped": 0,
    "coverage_status": "available"
  },
  "communities": {
    "count": 9,
    "status": "available",
    "by_health": {
      "scattered": 8,
      "isolated": 1
    },
    "by_source": {
      "hybrid": 8,
      "directory": 1
    },
    "by_algorithm": {
      "directory_with_graph_hints": 6,
      "directory_bfs_refinement": 3
    }
  },
  "flows": {
    "count": 80,
    "status": "available",
    "by_entry_source": {
      "cli_like": 56,
      "zero_in_degree_calls": 18,
      "test_like": 6
    },
    "by_entry_confidence": {
      "Inferred": 80
    },
    "truncated_count": 0
  },
  "warnings": [
    {
      "type": "skipped_sensitive",
      "count": 3
    },
    {
      "type": "high_unresolved_edge_rate",
      "scope": "last_build",
      "rate": 0.6064410480349345,
      "unresolved_count": 1111
    },
    {
      "type": "parse_error_files",
      "count": 4
    },
    {
      "type": "module_only_files",
      "count": 9
    }
  ],
  "limitations": [
    {
      "code": "parse-error-files",
      "count": 4,
      "samples": [
        "src/cli/commands/doctor.js",
        "src/cli/plugin.js",
        "src/crg/parser.js",
        "tests/contracts/crg-cli-v1.test.js"
      ]
    },
    {
      "code": "skipped-sensitive-files",
      "count": 3
    },
    {
      "code": "unresolved-edges",
      "count": 1111
    }
  ]
}